{
  "schema": "trecap_phase2_de1soc_clock_reset_architecture_v1",
  "file_class": "[1] hand-written Step-10 clock/reset architecture contract",
  "project": "T_RECAP_Phase2",
  "board": "de1soc",
  "contract_stage": "step10_clock_reset_architecture_source_implemented",
  "status": "source_implemented_pending_rtl_compile_functional_verification_platform_designer_generation_quartus_timing_and_hardware_evidence",
  "implementation_state": {
    "single_fabric_clock_domain_bound": true,
    "qualified_board_reset_release_bound": true,
    "board_and_hps_reset_combined_once": true,
    "single_platform_reset_synchronizer_bound": true,
    "exact_average_clock_enables_bound": true,
    "telemetry_soft_reset_is_synchronous_clear": true,
    "audio_edge_specific_reset_release_bound": true,
    "rtl_compile": false,
    "functional_verification": false,
    "platform_designer_generation": false,
    "quartus_compile": false,
    "timing_closure": false,
    "hardware_signoff": false
  },
  "source_ownership": {
    "physical_board_top": "rtl/platform/de1soc/de1_soc_trecap_top.sv",
    "clock_reset_controller": "rtl/platform/de1soc/clock_reset_ctrl.sv",
    "reset_synchronizer": "rtl/common/reset_sync.sv",
    "audio_platform_wrapper": "rtl/platform/de1soc/audio_codec_wrapper.sv",
    "adc_platform_wrapper": "rtl/platform/de1soc/adc_wrapper.sv",
    "telemetry_composition": "rtl/top/trecap_de1soc_full_top.sv",
    "telemetry_owner": "rtl/telemetry/trecap_telemetry_top.sv",
    "platform_designer_wrapper": "rtl/platform/de1soc/platform_designer_wrapper.sv",
    "platform_designer_script": "platform/de1soc/qsys/platform_designer.tcl",
    "platform_designer_source": "platform/de1soc/qsys/system.qsys",
    "primary_constraints": "constraints/de1soc/de1soc.sdc",
    "supplemental_clock_constraints": "constraints/de1soc/clocks.sdc"
  },
  "fabric_clock_domain": {
    "canonical_clock_input": "CLOCK_50",
    "canonical_clock_net": "clk_fabric",
    "frequency_hz": 50000000,
    "period_ns": "20.000",
    "active_fabric_domains": 1,
    "pll_present": false,
    "gated_clock_permitted": false,
    "alternate_board_clocks_active": false,
    "split_clock_profile_supported": false,
    "clock_enable_pulses_replace_derived_low_rate_clocks": true,
    "platform_designer_clock_export": "clk_50",
    "platform_designer_clock_instance": "clk_0"
  },
  "reset_architecture": {
    "board_reset_input": "KEY[0]",
    "board_reset_polarity": "active_low",
    "board_release_qualification": "stable_high_for_20ms_in_CLOCK_50_domain",
    "board_release_qualification_cycles": 1000000,
    "hps_reset_input": "h2f_reset_n_i",
    "combined_async_release_request": "qualified_board_release_n_and_h2f_reset_n_i",
    "reset_requests_combined_locations": 1,
    "reset_synchronizer_module": "trecap_reset_sync",
    "reset_synchronizer_instance": "u_platform_reset_sync",
    "minimum_release_stages": 2,
    "canonical_platform_reset": "rst_n_platform",
    "asynchronous_assertion": true,
    "synchronous_deassertion": true,
    "clock_reset_controller_owns_final_reset": true,
    "board_top_second_reset_synchronizer_permitted": false,
    "pseudo_per_domain_clock_outputs_permitted": false,
    "pseudo_per_domain_reset_outputs_permitted": false,
    "hardwired_pll_lock_permitted": false
  },
  "clock_enable_architecture": {
    "generator_kind": "rational_phase_accumulator_clock_enable",
    "reference_parameter": "FABRIC_CLK_HZ",
    "clock_enable_rates_hz": {
      "sample_tick_o": 48000,
      "status_tick_o": 10,
      "metrics_tick_o": 30,
      "heartbeat_toggle_o": 2
    },
    "exact_average_rate_required": true,
    "one_cycle_pulses_required": true,
    "integer_period_divider_permitted": false,
    "heartbeat_output_action": "toggle_heartbeat_state_on_each_2Hz_enable",
    "heartbeat_output_average_hz": 1
  },
  "canonical_binding_policy": {
    "fabric_clock_for_board_integration": "clk_fabric",
    "fabric_reset_for_board_integration": "rst_n_platform",
    "clock_reset_controller_instance": "u_clock_reset_ctrl",
    "required_shared_domain_instances": [
      "u_platform_designer_wrapper",
      "u_audio_codec_wrapper",
      "u_adc_wrapper",
      "u_source_core_integration",
      "u_full_top"
    ],
    "low_rate_events_are_enables_not_clocks": true,
    "board_key_and_switch_conditioning_owner": "clock_reset_ctrl",
    "raw_board_controls_may_drive_functional_logic_outside_owner": false
  },
  "telemetry_reset_policy": {
    "soft_reset_signal": "telemetry_soft_reset_pulse",
    "semantic": "one_cycle_synchronous_clear",
    "may_gate_or_derive_async_reset": false,
    "may_enter_event_control": false,
    "formatter_state_clear": true,
    "packet_fifo_flush": true,
    "transport_state_clear": true,
    "platform_reset_remains_only_async_reset_source": true
  },
  "audio_clock_reset_policy": {
    "audio_clock": "AUD_BCLK",
    "audio_clock_is_asynchronous_to_fabric": true,
    "receive_edge": "posedge",
    "receive_reset_instance": "u_bclk_rx_reset_sync",
    "transmit_edge": "negedge",
    "transmit_reset_instance": "u_bclk_tx_reset_sync",
    "edge_specific_synchronous_release_required": true,
    "master_clock_policy": "AUD_XCK_from_audio_pll_wrapper_12_288_MHz_with_lock_qualified_codec_init",
    "live_audio_timing_constrained": false,
    "live_audio_ready_claimed": false
  },
  "adc_clock_policy": {
    "serial_clock_signal": "ADC_SCLK",
    "semantic": "registered_protocol_output_driven_from_clk_fabric",
    "internal_rtl_clock_permitted": false,
    "separate_clock_domain_claimed": false,
    "continuous_scheduler_kind": "exact_average_fractional_phase_accumulator",
    "continuous_scheduler_rate_hz": 100000,
    "continuous_scheduler_interval_jitter_max_fabric_cycles": 1,
    "integer_period_scheduler_permitted": false,
    "external_io_timing_constrained": false,
    "live_adc_ready_claimed": false
  },
  "platform_designer_clock_reset_boundary": {
    "input_clock_hz": 50000000,
    "input_clock_export": "clk_50",
    "input_reset_export": "reset_n",
    "typed_bridge_clock_owner": "clk_0.clk",
    "typed_bridge_reset_owner": "clk_0.clk_reset",
    "hps_reset_export": "h2f_reset",
    "generated_system_source_is_bootstrap": true,
    "generated_hdl_present": false,
    "generated_sdc_present": false
  },
  "constraint_policy": {
    "canonical_physical_clock": "CLOCK_50",
    "canonical_physical_period_ns": "20.000",
    "alternate_board_clock_constraints_active": false,
    "audio_clock_constraint_deferred": true,
    "adc_generated_clock_constraint_deferred": true,
    "platform_designer_generated_constraints_deferred": true,
    "timing_closed": false
  },
  "evidence_policy": {
    "source_checker": "scripts/check_de1soc_clock_reset.py",
    "schema_file": "spec/schemas/de1soc_clock_reset_architecture.schema.json",
    "default_checker_scope": "source_only",
    "source_check_is_rtl_compile": false,
    "source_check_is_functional_verification": false,
    "source_check_is_platform_designer_generation": false,
    "source_check_is_quartus_compile": false,
    "source_check_is_timing_closure": false,
    "source_check_is_hardware_signoff": false
  },
  "validation_rules": [
    "The active FPGA fabric shall use CLOCK_50 through clk_fabric as its only functional fabric clock; the peripheral audio PLL drives only AUD_XCK and does not create a core, telemetry, or HPS fabric domain.",
    "clock_reset_ctrl shall require KEY[0] to remain high for 20 ms in the CLOCK_50 domain before board reset release becomes eligible.",
    "The qualified board release and h2f_reset_n_i shall be combined exactly once inside clock_reset_ctrl before one final trecap_reset_sync instance.",
    "The final trecap_reset_sync shall use at least two stages, assert rst_n_platform asynchronously, and release it synchronously in the CLOCK_50 domain.",
    "The physical board top shall not add a second reset synchronizer or expose pseudo core, telemetry, or HPS-bridge clock/reset domains.",
    "All shared-domain board integration modules shall consume clk_fabric and rst_n_platform; low-rate scheduler events shall remain clock enables, never derived clocks.",
    "Sample, status, metrics, and heartbeat events shall use rational phase accumulators referenced to FABRIC_CLK_HZ for exact average rates of 48 kHz, 10 Hz, 30 Hz, and 2 Hz respectively.",
    "The heartbeat state shall toggle on every 2 Hz heartbeat clock-enable pulse, producing a 1 Hz full waveform without creating another clock domain.",
    "Telemetry soft reset shall remain a one-cycle synchronous clear/flush event and shall never gate, derive, or enter an asynchronous reset or event control.",
    "The audio receive state shall release reset on AUD_BCLK positive edges and the audio transmit state shall release reset on AUD_BCLK negative edges.",
    "AUD_XCK shall come only from the reviewed audio PLL source and codec initialization shall wait for qualified lock; live audio timing and hardware behavior remain unclaimed pending TimeQuest and board evidence.",
    "ADC_SCLK shall remain a registered serial-protocol output driven by clk_fabric and shall never be used as an internal RTL clock.",
    "The ADC continuous-request scheduler shall use an exact-average 100 kHz fractional phase accumulator; its interval may dither by at most one clk_fabric cycle.",
    "The checked-in Platform Designer graph shall retain one 50 MHz clk_0 source and use clk_0.clk and clk_0.clk_reset for the typed CSR and F2SDRAM bridges.",
    "The physical TimeQuest source shall constrain only CLOCK_50 at 20.000 ns; alternate board clocks, audio clocks, ADC generated clocks, and generated Platform Designer timing remain deferred.",
    "The Step-10 checker establishes source structure only and shall not be presented as RTL compilation, functional verification, Platform Designer generation, Quartus compilation, timing closure, or hardware evidence."
  ]
}
